{
  "blob_count": 19,
  "blob_sha256": [
    "0b7ab6a52a99554acba77129b280f8d5e9e7b6548e0cf1643b76b2863ab41bd2",
    "254173b91d2b03c277aff117c58561af78740dc4584b17252c6c53f4a091aac7",
    "2b4164d7b4369ddeb2baeb8cd3f64adc19b6381ef36b89df481411152e309c53",
    "317b1d776c70aa6b3ed6d0ede4f9999af45a71b82e0840a5b093fba956675d75",
    "41f53b2c761100396a06ddc53957213a8c288e4b22929fd9dfa033e46ff5b130",
    "5c3d97657b63a5d6f4caaabf37ab59305156a4bf451c22636ef977595cd86a99",
    "5edf19190a3547cfe8b746cabf169c8366006e72ab888f0b091d67870ea69a08",
    "693163abecc25baa47932ce29f7351850abd835a0ed11bdbe10698174d6cf4fa",
    "71d3f5a34ef45c1c4667f9d160fe9d8900b380d73f78cdb905622a9ec28d6740",
    "7c88e6f8ec06012ae0e5420398a7ff52451fadb33c6168d49b1e93e23e231d33",
    "852d47e423ce211952e903024de34092dc69b22e65c74659b6339f29f124f56a",
    "8ba6bdf03c796c10c76cdeb567a1736c0af2d43ac20f10f9823a51c5080fe90e",
    "acaace40981e1c71562de1c7203a23f3c69b0166daa5c1ccac40131395a25523",
    "b2295033ddcbf5646444da733e93637ecb46899ff6f3ba740c39d1c253a794fc",
    "d0fe3bf0c5773fea7230e29659eb9943b19bf9ef7b6b4a666853d426bce728e1",
    "d87239ace06af2d6f0dde9a86424217f7b9e698505871aec821b097b1a862270",
    "e346432021b04179518d9614f3560ccd71354a4ee101ddcb893d6959a9d6301c",
    "f54182cc439b60daf6daa0e9ad060a63648e77d90092bea8ed957a18fa446266",
    "f5b3c511e47c8e902e9ccaf1df8525ba017dc1eae3e008713e4471fc0297a5bf"
  ],
  "created_by": "FARIS 0.2.0",
  "entries": [
    "blobs/0b7ab6a52a99554acba77129b280f8d5e9e7b6548e0cf1643b76b2863ab41bd2",
    "blobs/254173b91d2b03c277aff117c58561af78740dc4584b17252c6c53f4a091aac7",
    "blobs/2b4164d7b4369ddeb2baeb8cd3f64adc19b6381ef36b89df481411152e309c53",
    "blobs/317b1d776c70aa6b3ed6d0ede4f9999af45a71b82e0840a5b093fba956675d75",
    "blobs/41f53b2c761100396a06ddc53957213a8c288e4b22929fd9dfa033e46ff5b130",
    "blobs/5c3d97657b63a5d6f4caaabf37ab59305156a4bf451c22636ef977595cd86a99",
    "blobs/5edf19190a3547cfe8b746cabf169c8366006e72ab888f0b091d67870ea69a08",
    "blobs/693163abecc25baa47932ce29f7351850abd835a0ed11bdbe10698174d6cf4fa",
    "blobs/71d3f5a34ef45c1c4667f9d160fe9d8900b380d73f78cdb905622a9ec28d6740",
    "blobs/7c88e6f8ec06012ae0e5420398a7ff52451fadb33c6168d49b1e93e23e231d33",
    "blobs/852d47e423ce211952e903024de34092dc69b22e65c74659b6339f29f124f56a",
    "blobs/8ba6bdf03c796c10c76cdeb567a1736c0af2d43ac20f10f9823a51c5080fe90e",
    "blobs/acaace40981e1c71562de1c7203a23f3c69b0166daa5c1ccac40131395a25523",
    "blobs/b2295033ddcbf5646444da733e93637ecb46899ff6f3ba740c39d1c253a794fc",
    "blobs/d0fe3bf0c5773fea7230e29659eb9943b19bf9ef7b6b4a666853d426bce728e1",
    "blobs/d87239ace06af2d6f0dde9a86424217f7b9e698505871aec821b097b1a862270",
    "blobs/e346432021b04179518d9614f3560ccd71354a4ee101ddcb893d6959a9d6301c",
    "blobs/f54182cc439b60daf6daa0e9ad060a63648e77d90092bea8ed957a18fa446266",
    "blobs/f5b3c511e47c8e902e9ccaf1df8525ba017dc1eae3e008713e4471fc0297a5bf",
    "evidence-store/blobs/14/1443c45eb3b15bdedd132c42e4f5c42890791c740cc1a5e7491a562189e1f646.xz",
    "evidence-store/blobs/1a/1a76b9ecad9dad52b8f25035780122bcff3819da62579be69932a01ca0d8bdae.xz",
    "evidence-store/blobs/2e/2eb67d737e0e3b3d3f777bec928098dbc6db19fe08ccb948e2ff02e6717751a4.xz",
    "evidence-store/blobs/33/336a60d8f43f0b097cccca7a04a56f3938e5d7ffb1bea426d86eb22892193156.xz",
    "evidence-store/blobs/47/47bb54c75bae26999a8080898f14b90b45196d5af7400d1df1d317819d8a8bbc.xz",
    "evidence-store/blobs/95/95a4dae62f47206473933b35f08f349ee28c088549e21e6d6bc53628ab6062f4.xz",
    "evidence-store/blobs/ed/eda88fb9aa5dd4b15bbc7ce97d5e1334dd7881cf15ed0735eb0db06876d0008e.xz",
    "evidence-store/blobs/ef/eff5b8865347b3811efb86683e68491956fe8cb758df5ea3cb119611c64e953e.xz",
    "evidence-store/store.json",
    "manifest.json",
    "mimetype"
  ],
  "evidence_mode": "store-packed",
  "format": "faris-study/1",
  "has_preview": false,
  "record_count": 8
}
