{
  "blob_count": 1,
  "blob_sha256": [
    "e346432021b04179518d9614f3560ccd71354a4ee101ddcb893d6959a9d6301c"
  ],
  "created_by": "FARIS 0.2.0",
  "entries": [
    "blobs/e346432021b04179518d9614f3560ccd71354a4ee101ddcb893d6959a9d6301c",
    "manifest.json",
    "mimetype"
  ],
  "evidence_mode": "none",
  "format": "faris-study/1",
  "has_preview": false,
  "record_count": 0
}
