{
  "blob_count": 10,
  "blob_sha256": [
    "0b7ab6a52a99554acba77129b280f8d5e9e7b6548e0cf1643b76b2863ab41bd2",
    "2b4164d7b4369ddeb2baeb8cd3f64adc19b6381ef36b89df481411152e309c53",
    "317b1d776c70aa6b3ed6d0ede4f9999af45a71b82e0840a5b093fba956675d75",
    "5c3d97657b63a5d6f4caaabf37ab59305156a4bf451c22636ef977595cd86a99",
    "71d3f5a34ef45c1c4667f9d160fe9d8900b380d73f78cdb905622a9ec28d6740",
    "7c88e6f8ec06012ae0e5420398a7ff52451fadb33c6168d49b1e93e23e231d33",
    "852d47e423ce211952e903024de34092dc69b22e65c74659b6339f29f124f56a",
    "8ba6bdf03c796c10c76cdeb567a1736c0af2d43ac20f10f9823a51c5080fe90e",
    "d87239ace06af2d6f0dde9a86424217f7b9e698505871aec821b097b1a862270",
    "f54182cc439b60daf6daa0e9ad060a63648e77d90092bea8ed957a18fa446266"
  ],
  "created_by": "FARIS 0.2.0",
  "entries": [
    "blobs/0b7ab6a52a99554acba77129b280f8d5e9e7b6548e0cf1643b76b2863ab41bd2",
    "blobs/2b4164d7b4369ddeb2baeb8cd3f64adc19b6381ef36b89df481411152e309c53",
    "blobs/317b1d776c70aa6b3ed6d0ede4f9999af45a71b82e0840a5b093fba956675d75",
    "blobs/5c3d97657b63a5d6f4caaabf37ab59305156a4bf451c22636ef977595cd86a99",
    "blobs/71d3f5a34ef45c1c4667f9d160fe9d8900b380d73f78cdb905622a9ec28d6740",
    "blobs/7c88e6f8ec06012ae0e5420398a7ff52451fadb33c6168d49b1e93e23e231d33",
    "blobs/852d47e423ce211952e903024de34092dc69b22e65c74659b6339f29f124f56a",
    "blobs/8ba6bdf03c796c10c76cdeb567a1736c0af2d43ac20f10f9823a51c5080fe90e",
    "blobs/d87239ace06af2d6f0dde9a86424217f7b9e698505871aec821b097b1a862270",
    "blobs/f54182cc439b60daf6daa0e9ad060a63648e77d90092bea8ed957a18fa446266",
    "manifest.json",
    "mimetype"
  ],
  "evidence_mode": "none",
  "format": "faris-study/1",
  "has_preview": false,
  "record_count": 2
}
